{
  "id": "0004",
  "name": "부티",
  "genus": "불씨염소",
  "region": "하림",
  "type": "불꽃",
  "type2": null,
  "stage": 1,
  "evolvesFrom": null,
  "evolvesInto": "0005",
  "evolve": null,
  "habitat": "하림광장 뒤 마른 언덕",
  "heightCm": 44,
  "weightG": 11000,
  "diet": "마른 풀. 불이 약하면 숯 조각을 찾는다",
  "social": "무리",
  "ability": "뿔심지",
  "base": { "hp": 46, "atk": 58, "def": 44, "spa": 48, "spd": 44, "spe": 52 },
  "moves": [
    { "lv": 1, "name": "들이받기", "type": "노말", "power": 40, "category": "물리" },
    { "lv": 1, "name": "겁주기", "type": "노말", "power": null, "category": "변화" },
    { "lv": 5, "name": "뿔불", "type": "불꽃", "power": 40, "category": "특수" },
    { "lv": 12, "name": "뿔치기", "type": "불꽃", "power": 50, "category": "물리" }
  ],
  "dex": [
    "부티는 짧은 뿔 끝에만 불씨를 달고 다닌다. 꼬리에는 불이 없다.",
    "무리는 다섯을 넘기지 않고, 불씨가 꺼진 개체는 가운데로 들여보낸다."
  ],
  "silhouette": "새끼 염소. 짧은 뿔 두 개의 끝에만 작은 불. 꼬리는 짧고 어둡다.",
  "palette": ["모래색 털", "뿔 끝의 주황"],
  "reject": "꼬리 끝 불꽃, 도마뱀, 갈기",
  "art": null,
  "status": "reviewed"
}
