{
  "id": "0003",
  "name": "도토론",
  "genus": "수관다람쥐",
  "region": "하림",
  "type": "풀",
  "type2": "비행",
  "stage": 3,
  "evolvesFrom": "0002",
  "evolvesInto": null,
  "evolve": "레벨 34",
  "habitat": "숲 위쪽 수관",
  "heightCm": 118,
  "weightG": 31000,
  "diet": "단단한 열매. 자기 꼬리의 잎은 먹지 않는다",
  "social": "혼자",
  "ability": "씨주머니",
  "base": { "hp": 82, "atk": 88, "def": 72, "spa": 102, "spd": 80, "spe": 96 },
  "moves": [
    { "lv": 1, "name": "바람잎", "type": "풀", "power": 60, "category": "특수" },
    { "lv": 1, "name": "활공", "type": "비행", "power": 60, "category": "물리" },
    { "lv": 34, "name": "우산잎", "type": "풀", "power": 90, "category": "특수" },
    { "lv": 40, "name": "덮치기", "type": "비행", "power": 80, "category": "물리" }
  ],
  "dex": [
    "도토론의 꼬리는 우산처럼 퍼진 잎 덩어리다. 그 그늘에 작은 새가 잠시 앉는 일이 있다.",
    "활공 막과 꼬리를 동시에 펼치면 숲 위를 한 번에 건넌다."
  ],
  "silhouette": "큰 다람쥐. 꼬리만 우산처럼 넓고, 등에는 아무것도 심겨 있지 않다.",
  "palette": ["짙은 갈색", "꼬리 잎의 초록"],
  "reject": "등 구근, 꽃, 공룡 윤곽",
  "art": null,
  "status": "reviewed"
}
