{
  "id": "0006",
  "name": "부티칸",
  "genus": "화로염소",
  "region": "하림",
  "type": "불꽃",
  "type2": null,
  "stage": 3,
  "evolvesFrom": "0005",
  "evolvesInto": null,
  "evolve": "레벨 34",
  "habitat": "용암시티로 가는 마른 고개",
  "heightCm": 151,
  "weightG": 78000,
  "diet": "마른 관목. 방울 안의 불은 먹이와 따로 유지한다",
  "social": "혼자",
  "ability": "뿔심지",
  "base": { "hp": 84, "atk": 112, "def": 78, "spa": 70, "spd": 72, "spe": 98 },
  "moves": [
    { "lv": 1, "name": "뿔치기", "type": "불꽃", "power": 50, "category": "물리" },
    { "lv": 1, "name": "비탈받이", "type": "노말", "power": 60, "category": "물리" },
    { "lv": 34, "name": "방울화로", "type": "불꽃", "power": 90, "category": "특수" },
    { "lv": 42, "name": "들이뿔", "type": "불꽃", "power": 100, "category": "물리" }
  ],
  "dex": [
    "부티칸은 목의 방울을 열면 안의 불이 드러난다. 방울을 닫으면 열만 남는다.",
    "그을린 큰 뿔로 들이받는 동안에는 방울을 열지 않는다."
  ],
  "silhouette": "큰 산양. 검게 그을린 곡선 뿔. 목에 열린 방울 하나. 날개와 꼬리 불꽃은 없다.",
  "palette": ["그을린 흑갈", "방울 안의 주황"],
  "reject": "도마뱀, 날개, 꼬리 끝 불꽃",
  "art": null,
  "status": "reviewed"
}
